{
  "$ref": "#/definitions/categories",
  "definitions": {
    "categories": {
      "type": "object",
      "properties": {
        "lang": {
          "type": "string",
          "enum": [
            "en",
            "zh"
          ],
          "default": "en"
        },
        "name": {
          "type": "string"
        },
        "slug": {
          "type": "string"
        },
        "description": {
          "type": "string"
        },
        "icon": {
          "type": "string"
        },
        "parentCategory": {
          "type": "string"
        },
        "subcategories": {
          "type": "array",
          "items": {
            "type": "string"
          },
          "default": []
        },
        "productCount": {
          "type": "integer",
          "default": 0
        },
        "reviewCount": {
          "type": "integer",
          "default": 0
        },
        "featured": {
          "type": "boolean",
          "default": false
        },
        "$schema": {
          "type": "string"
        }
      },
      "required": [
        "name",
        "slug",
        "description"
      ],
      "additionalProperties": false
    }
  },
  "$schema": "http://json-schema.org/draft-07/schema#"
}